<?xml version="1.0" encoding="UTF-8" standalone="no"?>
<!DOCTYPE QCM SYSTEM "questions.dtd">
<QCM>
    <meta>
        <id>1</id>
        <cours>Développement Web</cours>
        <difficulte>Facile</difficulte>
    </meta>
    <question>
        <id>1</id>
        <enonce>Quel langage utilise t'on pour gérer une BD ?</enonce>
        <reponse>
            <id>a</id>
            <value>SQL</value>
        </reponse>
        <reponse>
            <id>b</id>
            <value>HTML</value>
        </reponse>
        <reponse>
            <id>c</id>
            <value>C++</value>
        </reponse>
    </question>
    <question>
        <id>2</id>
        <enonce>La question 2: </enonce>
        <reponse>
            <id>a</id>
            <value>Réponse a</value>
        </reponse>
        <reponse>
            <id>b</id>
            <value>Réponse a</value>
        </reponse>
        <reponse>
            <id>c</id>
            <value>Réponse a</value>
        </reponse>
        <reponse>
            <id>d</id>
            <value>Réponse a</value>
        </reponse>
    </question>
</QCM>